{"schema_version":"unirouter.source-evidence.component-verifier-release.v1","verifier_id":"unirouter.source-evidence.component-verifier.v1","producer_contract_id":"unirouter.source-evidence.component-package.v1","producer_contract_sha256":"sha256:99cfa123a93ec7464cfd0228143d59bf579621095cdf69337109e0d5d4ed803e","source_commit":"6666666666666666666666666666666666666666","source_tree":"7777777777777777777777777777777777777777","binary_sha256":"sha256:ba574ac25abd063914d785a34d097b14a1cf09021a953c40803414900c1f3dc1","integration_control_pin_sha256":"sha256:51ca89ef23eefc793bb05c03083e8a0f545eb59e54820fb16dffcd91e8fe8e4a","built_at":"2029-12-31T23:58:00Z"}